title,link,date & time
# Working From Home: A Guide to Success,https://www.rithmschool.com/blog/working-from-home-guide-to-success,2020-03-16 21:59:56 UTC
How To Get Good At Coding Challenges,https://www.rithmschool.com/blog/how-to-get-good-at-coding-challenges,2020-03-04 21:47:44 UTC
Avoid Recruiters: Embrace Cold Email,https://www.rithmschool.com/blog/avoid-recruiters-use-cold-email,2020-02-26 17:19:36 UTC
4 Strategies for Whiteboarding Success,https://www.rithmschool.com/blog/strategies-for-whiteboarding,2020-02-16 17:12:40 UTC
8 Questions You Should Consider Before Becoming A Software Engineer,https://www.rithmschool.com/blog/introduction-to-software-engineering,2020-02-13 20:07:09 UTC
Intro To Modern React - Preview,https://www.rithmschool.com/blog/intro-to-modern-react-preivew,2020-02-05 17:18:59 UTC
Alumni Spotlight: Orlando Wong,https://www.rithmschool.com/blog/alumni-spotlight-orlando-wong-rithm-school,2020-01-28 22:27:39 UTC
React Hooks! - useEffect,https://www.rithmschool.com/blog/react-hooks-use-effect,2020-01-14 00:00:00 UTC
It’s 2020: Where are the Women in Tech? ,https://www.rithmschool.com/blog/it-is-2020-where-are-the-women-in-tech,2019-12-20 00:00:00 UTC
Implementation Intentions: The Secret Weapon to Achieve Your Goals,https://www.rithmschool.com/blog/implementation-intentions,2019-12-12 00:00:00 UTC
An Introduction to GraphQL - Mutations,https://www.rithmschool.com/blog/an-introduction-to-graphql-mutations,2019-12-02 00:00:00 UTC
Student Interview: Jennifer + Luke on Company Projects,https://www.rithmschool.com/blog/student-interview-jennifer-luke,2019-11-07 00:00:00 UTC
React Hooks! - An Introduction,https://www.rithmschool.com/blog/react-hooks-intro,2019-10-22 00:00:00 UTC
An Introduction to GraphQL - Queries,https://www.rithmschool.com/blog/an-introduction-to-graphql-queries,2019-10-15 00:00:00 UTC
Alumni Spotlight: Sandy Cao,https://www.rithmschool.com/blog/alumni-spotlight-sandy,2019-10-10 00:00:00 UTC
Student Interview: Pair Programming And Company Projects,https://www.rithmschool.com/blog/student-interview-pair-programming-and-company-projects,2019-09-03 00:00:00 UTC
Getting Acquainted With A Production Code Base,https://www.rithmschool.com/blog/getting-up-to-speed-on-a-production-code-base,2019-06-18 00:00:00 UTC
"Staff Spotlight - Zach DeRossette, Career Coach",https://www.rithmschool.com/blog/staff-spotlight-zach-derossette,2019-05-22 00:00:00 UTC
Student Interview: Lena Ryoo on Company Projects,https://www.rithmschool.com/blog/student-interview-lena-ryoo,2019-05-15 00:00:00 UTC
Debugging Like a Scientist,https://www.rithmschool.com/blog/debugging-like-a-scientist,2019-04-29 00:00:00 UTC
